{"data_catalog_sha256":"2222222222222222222222222222222222222222222222222222222222222222","disposable_target_fingerprint":"bbbbbbbbbbbbbbbbbbbbbbbbbbbbbbbbbbbbbbbbbbbbbbbbbbbbbbbbbbbbbbbb","dump_duration_ms":1000,"dump_finished_at":"2026-07-31T01:00:03.000Z","dump_sha256":"dddddddddddddddddddddddddddddddddddddddddddddddddddddddddddddddd","dump_started_at":"2026-07-31T01:00:02.000Z","observed_at":"2026-07-31T01:00:07.000Z","pg_dump_version":"pg_dump (PostgreSQL) 16.10","pg_restore_version":"pg_restore (PostgreSQL) 16.10","post_security_catalog_sha256":"ffffffffffffffffffffffffffffffffffffffffffffffffffffffffffffffff","pre_security_catalog_sha256":"eeeeeeeeeeeeeeeeeeeeeeeeeeeeeeeeeeeeeeeeeeeeeeeeeeeeeeeeeeeeeeee","receipt_sha256":"34fdfa3dee7dd9bebfacf922cc8557693343315952932ec8ec19f66868910206","restore_duration_ms":1000,"restore_finished_at":"2026-07-31T01:00:06.000Z","restore_reconcile_sha256":"8b61e1e0e601fdf0f35261f9ec9066551ca25c697c3b5ea767406a66cf439f62","restore_run_uid":"12345678-1234-4abc-8def-1234567890ab","restore_started_at":"2026-07-31T01:00:05.000Z","result":"verified","schema_catalog_sha256":"1111111111111111111111111111111111111111111111111111111111111111","schema_version":"dgkma-restore-validation-v1","sequence_60_artifact_id":"database-security-v1","sequence_60_artifact_sha256":"6c2fec9c5a2decb6eb5b4be2251685d00da07815f44fc307f47bf94d222305f0","source_current_wal_lsn":"0/1a2b3c","source_manifest_sha256":"4691d969300653ae13d850c02a411181ed5ec19debece8a2e95bbe0a899db23a","source_server_version_num":160010,"source_snapshot_finished_at":"2026-07-31T01:00:04.000Z","source_snapshot_id_sha256":"cccccccccccccccccccccccccccccccccccccccccccccccccccccccccccccccc","source_snapshot_observed_at":"2026-07-31T01:00:01.000Z","source_snapshot_started_at":"2026-07-31T01:00:00.000Z","source_target_fingerprint":"aaaaaaaaaaaaaaaaaaaaaaaaaaaaaaaaaaaaaaaaaaaaaaaaaaaaaaaaaaaaaaaa","source_txid_snapshot":"100:200:"}
